{
  "schema": "cheatengine-consumed-sdk/v0",
  "id": "CheatEngine.SDK",
  "version": "1.0.0",
  "range": "[1.0.0, 2.0.0)",
  "contentHashSha512": "n7nHqZ8vzo7Vf20jF0fkh/jUtR3yo1TwRGpXE7ERxZeJ4C5S/Nsft4lqOg7zGwfsD5Nh9tTVgdw4PrybJRF0gA==",
  "attestedAssetSha256": "99bf90101cd13e0183c94759e43badc6a1e719ffc3e2c9fd0b93490abdac0632",
  "nugetOrgSignedSha256": "3e8c98583ac71af25a5bd7053e7583fbafcd196139fae7c0b04bae9b40a7cd33",
  "nugetOrgSignedSha512": "1a2B/E6reX5e636hfdb+Zdj3kT6817DuNES1RWvprhRyuyztE/56Zk2iHOMQIKpGH+O2Va8rYJxXXXTVq5aN9Q==",
  "sourceCommit": "a6fefb93e9c6f85a1bcedb68bf97e6741175b227",
  "sourceTreeHash": "41678f939547b2215e106ee3bbc8c2878815652e",
  "nativeBridge": {
    "packagePath": "build/native/cheatengine-sdk-lua-bridge.dll",
    "sha256": "da08c2ba03019da3a8c432ef061d5d6133fd2169ba3a6a8e9ac903353856d994",
    "sourceFingerprint": "8a63e00c7dd941212e7ef8c13d8c97f73142c5154bfbe5dbc5459e7131bb789b:2871368515be4c6fd235e49e793d5557e7c50229fcc8fbfd903efd39f9b754a8"
  },
  "lockFile": "libs/CheatEngine.Client.Core/packages.lock.json"
}
